<?xml version="1.0" encoding="UTF-8"?>


<cluster ver="1.0"
    xmlns="http://www.ibm.com/teal" 
    xmlns:xsi="http://www.w3.org/2001/XMLSchema-instance" 
    xsi:schemaLocation="http://www.ibm.com/teal ../../../../xml/location.xsd ">
  
    <location id="D" type="device" separator="##">
        <simple>
            <component type="node"/>
            <component type="device"/>
            <component type="major"/>
            <component type="minor"/>
        </simple>
    </location>

    <location id="A" type="application" separator="##">
        <simple>
            <component type="node"/>            
            <component type="application"/>
            <component type="pid"/>
            <component type="identifier"/>
        </simple>
    </location>

    <location id="J" type="job" separator="##">
        <simple>
            <component type="stepId"/>
            <component type="node"/>
            <component type="task"/>
        </simple>
    </location>

    <location id="H" type="hardware" separator="-">
        <complex>
            <!-- Level 1 -->
            <component type="frame" id="FR" pattern="00[1-9]|0[1-9][0-9]|[1-9][0-9][0-9]">
                <compref ref="cage"/>
            </component>

            <!-- Level 2 -->
            <component type="cage" id="CG" pattern="0[3-9]|1[0-4]">
                <compref ref="supernode"/>
            </component>
            
            <!-- Level 3 -->
            <component type="supernode" id="SN" pattern="[0-4][0-9][0-9]|50[0-9]|51[0-1]">
                <compref ref="drawer"/>
            </component>

            <!-- Level 4 -->
            <component type="drawer" id="DR" pattern="[0-3]">            
                    <compref ref="hub"/>
            </component>        

            <!-- Level 5 -->
            <component type="hub" id="HB" pattern="[0-7]">
                <compref ref="localPort"/>
                <compref ref="remotePort"/>
                <compref ref="nodePort"/>
                <compref ref="hfi"/>
                <compref ref="opticalModule"/>
            </component>

            <!-- Level 6 -->
            <component type="localPort" id="LL" pattern="0[0-6]"/>
            <component type="opticalModule" id="OM" pattern="[0-1][0-9]|2[0-7]">
                <compref ref="remotePort"/>
                <compref ref="nodePort"/>
            </component>
            <component type="hfi" id="HF" pattern="[0-1]">
                <compref ref="ramp"/>
            </component>
            
            <!-- Level 7 -->
            <component type="remotePort" id="LR" pattern="[0-1][0-9]|2[0-3]"/>
            <component type="nodePort" id="LD" pattern="0[0-9]|1[0-5]"/>
            <component type="ramp" id="RM" pattern="[0-3]"/>

        </complex>
    </location>
    <location id="P" type="pseries" separator="@">
    	<simple>
    		<component type="ploc"/>
    	</simple>
    </location>
    <location id="G" type="gpfs" separator="|">
    	<complex>
	        <!-- Level 1 -->
	        <component type="cluster" id="C" pattern=":.+">
	            <compref ref="filesystem"/>
	            <compref ref="disk"/>
	            <compref ref="recoveryGroup"/>
	            <compref ref="node"/>
	        </component>
	
	        <!-- Level 2 -->
	        <component type="filesystem" id="FS" pattern=":.+">
	            <compref ref="storagePool"/>
	            <compref ref="fileSet"/>
	        </component>
	        <component type="disk" id="DK" pattern=":.+"/>
	        <component type="recoveryGroup" id="RG" pattern=":.+">
	            <compref ref="declusteredArray"/>
	        </component>
	        <component type="node" id="N" pattern=":.+"/>
	        
	        <!-- Level 3 -->
	        <component type="storagePool" id="SP" pattern=":.+"/>
	        <component type="fileSet" id="FT" pattern=":.+"/>
	        <component type="declusteredArray" id="DA" pattern=":.+">
	            <compref ref="pdisk"/>
	            <compref ref="vdisk"/>
	        </component>
	        
	        <!-- Level 4 -->
	        <component type="pdisk" id="PD" pattern=":.+"/>
	        <component type="vdisk" id="VD" pattern=":.+"/>
		</complex>
    </location>
    <location id="U" type="ufm" separator="|">
    	<complex>
		    <!-- Level 1 -->
		    <component type="site" id="S" pattern=":.+">
			    <compref ref="switch"/>
		    	<compref ref="computer"/>
		    	<compref ref="gateway"/>
		    	<compref ref="vm"/>
		    	<compref ref="vmm"/>
		    </component>
		    
		    <!-- Level 2 -->
		    <component type="switch" id="SW" pattern=":.+">
		    	<compref ref="swport"/>
		    	<compref ref="line"/>
		    	<compref ref="spine"/>
		      	<compref ref="psu"/>
		      	<compref ref="smb"/>
		      	<compref ref="fan"/>
		    </component>
		    <component type="computer" id="C" pattern=":.+">
		    	<compref ref="cport"/>
		    </component>
		    <component type="gateway" id="GW" pattern=":.+"/>
		    <component type="vm" id="VM" pattern=":.+"/>
		    <component type="vmm" id="V" pattern=":.+"/>
		
		    <!-- Level 3 -->
		    <component type="cport" id="P" pattern=":.+"/>
		    <component type="swport" id="P" pattern=":.+"/>
		    <component type="line" id="P" pattern=":.+">
		    	<compref ref="lport"/>
		    </component>
		    <component type="spine" id="SP" pattern=":.+">
		    	<compref ref="spport"/>
		    </component>
		    <component type="psu" id="PS" pattern=":.+"/>
		    <component type="smb" id="SM" pattern=":.+"/>
		    <component type="fan" id="F" pattern=":.+"/>
		    
		    <!-- Level 4 -->
		    <component type="lport" id="P" pattern=":.+"/>
		    <component type="spport" id="P" pattern=":.+"/>
	    </complex>	    
    </location> 
</cluster>
